290,290,m290,Catwoman,2004,3.2,35065.0,['action' 'crime' 'fantasy'],tt0327554,3.4,108935.0,3.6,3.0,4848.0,1055.0,2435.0,4755.0,8019.0,12896.0,15498.0,17231.0,16800.0,25398.0,2.7,77.0,3.5,21958.0,3.2,49103.0,3.8,13148.0,3.2,70577.0,2.4,62.0,3.3,16099.0,3.1,40598.0,3.7,11060.0,4.0,16113.0,4.7,11.0,4.5,5521.0,3.7,7979.0,4.1,1883.0,3.5,617.0,3.0,19595.0,3.4,53833.0,Catwoman,2004-08-27,"Action, Crime, Fantasy",104.0,USA,"English, Spanish",Pitof,"Bob Kane, Theresa Rebeck",Warner Bros.,"Halle Berry, Benjamin Bratt, Sharon Stone, Lambert Wilson, Frances Conroy, Alex Borstein, Michael Massee, Byron Mann, Kim Smith, Christopher Heyerdahl, Peter Wingfield, Berend McKenzie, Chase Nelson-Murray, Manny Petruzzelli, Harley Reiner","A shy woman, endowed with the speed, reflexes, and senses of a cat, walks a thin line between criminal and hero, even as a detective doggedly pursues her, fascinated by both of her personas.",3.4,108935.0,$ 100000000,$ 40202379,$ 82102379,27.0,731.0,131.0
291,291,m291,Cellular,2004,6.5,32920.0,['action' 'crime' 'thriller'],tt0337921,6.5,91946.0,6.6,7.0,5531.0,4358.0,13107.0,28133.0,23096.0,9800.0,3982.0,1819.0,979.0,1141.0,6.9,21.0,6.7,14021.0,6.4,47531.0,6.5,12484.0,6.5,63801.0,6.8,13.0,6.7,11007.0,6.4,40258.0,6.4,10565.0,6.6,11997.0,6.7,3.0,6.9,2867.0,6.5,6869.0,6.7,1755.0,6.3,527.0,6.4,16738.0,6.5,49146.0,Cellular,2005-04-29,"Action, Crime, Thriller",94.0,"USA, Germany",English,David R. Ellis,"Larry Cohen, Chris Morgan",New Line Cinema,"Caroline Aaron, Kim Basinger, Brenda Ballard, Will Beinbrink, Jessica Biel, Chase Ellis Bloch, Chelsea Ellis Bloch, Chantille Boudousque, Robin Brenner, Richard Burgi, Paige Cannon, Nikki Christian, John Churchill, Greg Collins, Valerie Cruz",A young man receives an emergency phone call on his cell phone from an older woman. The catch? The woman claims to have been kidnapped; and the kidnappers have targeted her husband and child next.,6.5,91946.0,$ 25000000,$ 32003620,$ 57678321,60.0,379.0,70.0
292,292,m292,The Crying Game,1992,7.3,21394.0,['drama' 'thriller'],tt0104036,7.2,50217.0,7.3,7.0,4953.0,6416.0,13185.0,13022.0,6344.0,2693.0,1261.0,705.0,537.0,1101.0,7.1,8.0,7.2,3841.0,7.1,19621.0,7.4,14618.0,7.2,32266.0,7.5,4.0,7.2,3118.0,7.1,16327.0,7.4,11959.0,7.5,6397.0,6.3,3.0,7.3,668.0,7.4,3076.0,7.8,2452.0,7.0,503.0,7.2,12732.0,7.3,22748.0,La moglie del soldato,1993-02-11,"Crime, Drama, Romance",112.0,"UK, Japan",English,Neil Jordan,Neil Jordan,Palace Pictures,"Forest Whitaker, Miranda Richardson, Stephen Rea, Adrian Dunbar, Breffni McKenna, Joe Savino, Birdy Sweeney, Jaye Davidson, Andrée Bernard, Jim Broadbent, Ralph Brown, Tony Slattery, Jack Carr, Josephine White, Shar Campbell","A British soldier kidnapped by IRA terrorists soon befriends one of his captors, who then becomes drawn into the soldier's world.",7.2,50217.0,GBP 2300000,$ 62548947,$ 62548947,90.0,177.0,72.0
293,293,m293,Charade,1963,8.0,22815.0,['comedy' 'mystery' 'romance' 'thriller'],tt0056923,7.9,66360.0,8.0,8.0,10879.0,12810.0,22571.0,12581.0,4447.0,1428.0,565.0,309.0,189.0,581.0,7.9,25.0,8.0,8436.0,7.9,26138.0,7.9,15761.0,7.8,38131.0,7.8,19.0,7.9,5121.0,7.8,19258.0,7.9,12516.0,8.0,13342.0,7.9,5.0,8.1,3180.0,8.0,6553.0,8.1,3009.0,7.7,580.0,8.1,18385.0,7.8,27850.0,Sciarada,1963-12-19,"Comedy, Mystery, Romance",113.0,USA,"English, French, German, Italian, Spanish",Stanley Donen,"Peter Stone, Peter Stone",Stanley Donen Films,"Cary Grant, Audrey Hepburn, Walter Matthau, James Coburn, George Kennedy, Dominique Minot, Ned Glass, Jacques Marin, Paul Bonifas, Thomas Chelimsky",Romance and suspense ensue in Paris as a woman is pursued by several men who want a fortune her murdered husband had stolen. Whom can she trust?,7.9,66360.0,$ 3000000,,$ 173057,83.0,308.0,122.0
294,294,m294,Cherry Falls,2000,4.8,5669.0,['horror' 'mystery' 'thriller'],tt0175526,5.2,12021.0,5.3,5.0,756.0,263.0,676.0,1378.0,2402.0,2583.0,1753.0,1038.0,581.0,591.0,3.7,3.0,5.6,954.0,5.1,6179.0,5.1,2161.0,5.1,7323.0,5.0,1.0,5.6,614.0,5.1,4717.0,5.1,1833.0,5.3,2106.0,5.0,1.0,5.5,328.0,5.3,1407.0,5.3,301.0,5.0,297.0,5.7,2660.0,5.0,5988.0,Cherry Falls - Il paese del male,2000-08-25,"Horror, Mystery, Thriller",92.0,USA,English,Geoffrey Wright,Ken Selden,Rogue Pictures,"Brittany Murphy, Jay Mohr, Michael Biehn, Jesse Bradford, Candy Clark, Amanda Anka, Joe Inscoe, Gabriel Mann, Natalie Ramsey, Douglas Spain, Bre Blair, Kristen Miller, Michael Weston, Keram Malicki-Sánchez, Joannah Portman","In the small town of Cherry Falls, a psychotic murderer is killing off the virgins of the local high school.",5.2,12021.0,$ 14000000,,,,190.0,100.0
295,295,m295,Chill Factor,1999,4.9,5381.0,['action' 'adventure' 'comedy' 'thriller'],tt0163579,5.3,9149.0,5.3,5.0,369.0,176.0,542.0,1252.0,1925.0,2086.0,1193.0,710.0,458.0,438.0,,,5.6,325.0,5.2,4644.0,5.2,2042.0,5.2,6332.0,,,5.6,273.0,5.2,4183.0,5.1,1759.0,5.8,747.0,,,6.0,50.0,5.7,421.0,6.1,262.0,4.8,206.0,5.2,2558.0,5.2,4100.0,Chill Factor - Pericolo imminente,2001-05-18,"Action, Adventure, Comedy",102.0,USA,English,Hugh Johnson,"Drew Gitlin, Mike Cheda",Morgan Creek Entertainment,"Cuba Gooding Jr., Skeet Ulrich, Peter Firth, David Paymer, Hudson Leick, Daniel Hugh Kelly, Kevin J. O'Connor, Judson Mills, Jordan Mott, Darcas Macopson, Jim Grimshaw, Richard Todd Aguayo, K. Addison Young, James Van Harper, Tommy Smeltzer","A new biological chemical weapon that explodes up to temperatures over fifty degrees Fahrenheit, falls into the hands of two men who try to make sure that it doesn't get stolen by a terrorist.",5.3,9149.0,$ 70000000,$ 11263966,$ 11788676,33.0,91.0,69.0
296,296,m296,Chinatown,1974,8.5,80698.0,['crime' 'drama' 'mystery' 'thriller'],tt0071315,8.2,286798.0,8.1,8.0,54246.0,68285.0,86408.0,48881.0,16312.0,5818.0,2320.0,1230.0,847.0,2451.0,8.1,147.0,8.2,47954.0,8.1,118622.0,8.2,45928.0,8.2,194130.0,8.3,114.0,8.2,41124.0,8.1,105048.0,8.2,39668.0,7.9,25230.0,7.5,26.0,7.9,6206.0,7.8,12282.0,8.1,5573.0,8.2,754.0,8.4,61935.0,8.1,126159.0,Chinatown,1974-12-13,"Drama, Mystery, Thriller",130.0,USA,"English, Cantonese, Spanish",Roman Polanski,Robert Towne,Paramount Pictures,"Jack Nicholson, Faye Dunaway, John Huston, Perry Lopez, John Hillerman, Darrell Zwerling, Diane Ladd, Roy Jenson, Roman Polanski, Richard Bakalyan, Joe Mantell, Bruce Glover, Nandu Hinds, James O'Rear, James Hong","A private detective hired to expose an adulterer finds himself caught up in a web of deceit, corruption, and murder.",8.2,286798.0,$ 6000000,$ 29200000,$ 29225935,92.0,540.0,150.0
297,297,m297,Nuovo Cinema Paradiso,1988,8.5,46801.0,['comedy' 'drama' 'romance'],tt0095765,8.5,223050.0,8.4,9.0,62293.0,61148.0,54576.0,25298.0,9000.0,4066.0,2049.0,1025.0,964.0,2631.0,8.5,127.0,8.6,39299.0,8.4,88349.0,8.4,33223.0,8.5,134749.0,8.4,96.0,8.6,29444.0,8.4,70947.0,8.4,27198.0,8.5,32904.0,8.3,21.0,8.6,9210.0,8.5,16269.0,8.5,5466.0,7.6,597.0,8.3,29842.0,8.5,106413.0,Nuovo Cinema Paradiso,1988-11-17,Drama,155.0,"Italy, France",Italian,Giuseppe Tornatore,"Giuseppe Tornatore, Giuseppe Tornatore",Cristaldifilm,"Antonella Attili, Enzo Cannavale, Isa Danieli, Leo Gullotta, Marco Leonardi, Pupella Maggio, Agnese Nano, Leopoldo Trieste, Salvatore Cascio, Tano Cimarosa, Nicola Di Pinto, Roberta Lena, Nino Terzo, Jacques Perrin, Philippe Noiret",A filmmaker recalls his childhood when falling in love with the pictures at the cinema of his home village and forms a deep friendship with the cinema's projectionist.,8.5,223050.0,$ 5000000,$ 12397210,$ 13826605,80.0,514.0,117.0
298,298,m298,Citizen Kane,1941,8.6,140517.0,['drama' 'mystery'],tt0033467,8.3,389322.0,8.1,9.0,112009.0,83730.0,86611.0,50701.0,22871.0,12017.0,6207.0,4037.0,3152.0,7987.0,8.7,201.0,8.3,60736.0,8.2,155974.0,8.4,62563.0,8.3,245716.0,8.6,158.0,8.4,49659.0,8.2,132829.0,8.4,52683.0,8.1,42482.0,9.4,26.0,8.0,10220.0,8.0,21437.0,8.2,8929.0,8.3,768.0,8.5,92086.0,8.2,156064.0,Quarto potere,1948-11-25,"Drama, Mystery",119.0,USA,"English, Italian",Orson Welles,"Herman J. Mankiewicz, Orson Welles",RKO Radio Pictures,"Joseph Cotten, Dorothy Comingore, Agnes Moorehead, Ruth Warrick, Ray Collins, Erskine Sanford, Everett Sloane, William Alland, Paul Stewart, George Coulouris, Fortunio Bonanova, Gus Schilling, Philip Van Zandt, Georgia Backus, Harry Shannon","Following the death of publishing tycoon Charles Foster Kane, reporters scramble to uncover the meaning of his final utterance; 'Rosebud'.",8.3,389322.0,$ 839727,$ 1585634,$ 1594107,100.0,1452.0,248.0
299,299,m299,Clerks,1994,8.0,90972.0,['comedy'],tt0109445,7.7,209206.0,7.9,8.0,40468.0,36737.0,59972.0,39820.0,16219.0,6767.0,3165.0,1949.0,1403.0,2706.0,8.0,43.0,7.8,26689.0,7.7,106512.0,7.5,27377.0,7.7,144094.0,7.9,36.0,7.8,22786.0,7.8,93225.0,7.6,23558.0,7.5,19819.0,7.5,6.0,7.6,3607.0,7.5,12154.0,7.4,3401.0,7.0,669.0,7.8,63317.0,7.7,83085.0,Clerks - Commessi,1995-02-01,Comedy,92.0,USA,English,Kevin Smith,Kevin Smith,View Askew Productions,"Brian O'Halloran, Jeff Anderson, Marilyn Ghigliotti, Lisa Spoonauer, Jason Mewes, Kevin Smith, Scott Mosier, Scott Schiaffo, Al Berkowitz, Walter Flanagan, Ed Hapstak, Lee Bendick, David Klein, Pattijean Csik, Ken Clark","A day in the lives of two convenience clerks named Dante and Randal as they annoy customers, discuss movies, and play hockey on the store roof.",7.7,209206.0,$ 27000,$ 3151130,$ 3151130,70.0,649.0,138.0
300,300,m300,Cliffhanger,1993,6.2,34880.0,['action' 'adventure' 'thriller'],tt0106582,6.4,117604.0,6.5,7.0,5655.0,4677.0,16133.0,34046.0,31822.0,14480.0,5667.0,2541.0,1287.0,1296.0,6.4,22.0,6.5,8473.0,6.4,61527.0,6.4,20226.0,6.4,86451.0,6.2,17.0,6.5,7748.0,6.4,57072.0,6.4,18082.0,6.3,6567.0,7.0,4.0,6.4,624.0,6.2,3792.0,6.4,1850.0,6.4,668.0,6.4,20689.0,6.4,59642.0,Cliffhanger - L'ultima sfida,1993-10-29,"Action, Adventure, Thriller",113.0,"USA, Italy, France",English,Renny Harlin,"John Long, Michael France",Carolco Pictures,"Sylvester Stallone, John Lithgow, Michael Rooker, Janine Turner, Rex Linn, Caroline Goodall, Leon, Craig Fairbrass, Gregory Scott Cummins, Denis Forest, Michelle Joyner, Max Perlich, Paul Winfield, Ralph Waite, Trey Brownell",A botched mid-air heist results in suitcases full of cash being searched for by various groups throughout the Rocky Mountains.,6.4,117604.0,$ 70000000,$ 84049211,$ 255000211,60.0,209.0,99.0
301,301,m301,A Clockwork Orange,1971,8.5,197372.0,['crime' 'drama' 'sci-fi'],tt0066921,8.3,740301.0,8.2,9.0,183556.0,187384.0,178884.0,96515.0,39326.0,18939.0,10351.0,6994.0,5574.0,12778.0,8.7,427.0,8.4,145367.0,8.3,305721.0,8.0,81308.0,8.3,461693.0,8.7,295.0,8.4,110949.0,8.3,254849.0,8.1,69694.0,8.1,94325.0,8.2,81.0,8.3,31574.0,8.1,46964.0,7.7,10247.0,7.9,836.0,8.3,124327.0,8.3,323444.0,Arancia meccanica,1972-09-07,"Crime, Drama, Sci-Fi",136.0,"UK, USA",English,Stanley Kubrick,"Stanley Kubrick, Anthony Burgess",Warner Bros.,"Malcolm McDowell, Patrick Magee, Michael Bates, Warren Clarke, John Clive, Adrienne Corri, Carl Duering, Paul Farrell, Clive Francis, Michael Gover, Miriam Karlin, James Marcus, Aubrey Morris, Godfrey Quigley, Sheila Raynor","In the future, a sadistic gang leader is imprisoned and volunteers for a conduct-aversion experiment, but it doesn't go as planned.",8.3,740301.0,$ 2200000,$ 26589355,$ 26903440,77.0,1569.0,184.0
302,302,m302,Collateral,2004,7.8,106866.0,['crime' 'drama' 'thriller'],tt0369339,7.5,352788.0,7.6,8.0,29429.0,47767.0,119549.0,100618.0,35705.0,11116.0,3938.0,1774.0,981.0,1911.0,7.6,88.0,7.6,53044.0,7.5,182153.0,7.4,40852.0,7.5,257075.0,7.6,73.0,7.6,47609.0,7.5,163361.0,7.4,35435.0,7.2,27622.0,8.3,8.0,7.3,4800.0,7.1,16856.0,7.3,4795.0,7.3,734.0,7.7,62404.0,7.5,179701.0,Collateral,2004-10-15,"Crime, Drama, Thriller",120.0,USA,"English, Spanish, French, Korean",Michael Mann,Stuart Beattie,Paramount Pictures,"Tom Cruise, Jamie Foxx, Jada Pinkett Smith, Mark Ruffalo, Peter Berg, Bruce McGill, Irma P. Hall, Barry Shabaka Henley, Richard T. Jones, Klea Scott, Bodhi Elfman, Debi Mazar, Javier Bardem, Emilio Rivera, Jamie McBride",A cab driver finds himself the hostage of an engaging contract killer as he makes his rounds from hit to hit during one night in Los Angeles.,7.5,352788.0,$ 65000000,$ 101005703,$ 220926695,71.0,898.0,224.0
303,303,m303,Conspiracy Theory,1997,6.5,36045.0,['action' 'crime' 'mystery' 'romance' 'thriller'],tt0118883,6.7,92187.0,6.8,7.0,5100.0,5582.0,16385.0,30452.0,20564.0,8099.0,3049.0,1356.0,720.0,880.0,6.3,12.0,6.8,5208.0,6.7,45935.0,6.7,18543.0,6.7,61168.0,6.5,6.0,6.8,4198.0,6.7,39080.0,6.7,15646.0,6.9,10435.0,5.6,5.0,7.0,957.0,6.8,6352.0,6.9,2654.0,6.5,631.0,6.7,19304.0,6.7,43806.0,Ipotesi di complotto,1997-10-24,"Action, Mystery, Thriller",135.0,USA,English,Richard Donner,Brian Helgeland,Warner Bros.,"Mel Gibson, Julia Roberts, Patrick Stewart, Cylk Cozart, Steve Kahan, Terry Alexander, Alex McArthur, Rod McLachlan, Michael Potts, Jim Sterling, Rich Hebert, Brian J. Williams, G.A. Aguilar, Cece Neber Labao, Saxon Trainor","A taxi driver with a penchant for conspiracy theories becomes a target after one of these theories turns out to be true. Unfortunately, to save himself, he has to figure out which theory it is.",6.7,92187.0,$ 75000000,$ 75982834,$ 136982834,49.0,175.0,86.0
304,304,m304,Contact,1997,7.4,75043.0,['drama' 'mystery' 'sci-fi' 'thriller'],tt0118884,7.4,249088.0,7.6,8.0,33901.0,37440.0,65977.0,60777.0,28382.0,11197.0,4865.0,2507.0,1609.0,2433.0,7.4,52.0,7.6,25592.0,7.4,118436.0,7.4,43397.0,7.4,166680.0,7.4,41.0,7.6,21346.0,7.4,101449.0,7.4,36945.0,7.3,26276.0,6.7,7.0,7.5,3894.0,7.3,15464.0,7.3,5736.0,7.0,778.0,7.3,49479.0,7.4,114421.0,Contact,1997-11-26,"Drama, Mystery, Sci-Fi",150.0,USA,"English, Spanish, German, Russian",Robert Zemeckis,"James V. Hart, Michael Goldenberg",Warner Bros.,"Jena Malone, David Morse, Jodie Foster, Geoffrey Blake, William Fichtner, Sami Chester, Timothy McNeil, Laura Elena Surillo, Matthew McConaughey, Tom Skerritt, Henry Strozier, Max Martini, Larry King, Thomas Garner, Conroy Chino","Dr. Ellie Arroway, after years of searching, finds conclusive radio proof of extraterrestrial intelligence, sending plans for a mysterious machine.",7.4,249088.0,$ 90000000,$ 100920329,$ 171120329,62.0,705.0,173.0
305,305,m305,Cool Hand Luke,1967,8.3,46514.0,['crime' 'drama'],tt0061512,8.1,158422.0,8.1,8.0,27992.0,36899.0,50626.0,26948.0,8728.0,3192.0,1317.0,721.0,507.0,1492.0,7.6,62.0,8.1,18660.0,8.1,63771.0,8.2,34662.0,8.1,107146.0,7.9,43.0,8.1,16306.0,8.1,56667.0,8.2,29934.0,8.0,13450.0,6.7,15.0,8.0,2155.0,7.9,6470.0,8.2,4274.0,8.0,682.0,8.3,47504.0,7.9,58066.0,Nick mano fredda,1967-12-21,"Crime, Drama",127.0,USA,English,Stuart Rosenberg,"Donn Pearce, Frank Pierson",Jalem Productions,"Paul Newman, George Kennedy, J.D. Cannon, Lou Antonio, Robert Drivas, Strother Martin, Jo Van Fleet, Clifton James, Morgan Woodward, Luke Askew, Marc Cavell, Richard Davalos, Robert Donner, Warren Finnerty, Dennis Hopper","A laid back Southern man is sentenced to two years in a rural prison, but refuses to conform.",8.1,158422.0,$ 3200000,,,92.0,336.0,130.0
306,306,m306,Copycat,1995,6.5,17335.0,['crime' 'mystery' 'thriller'],tt0112722,6.6,52901.0,6.7,7.0,2466.0,2685.0,8602.0,16802.0,13535.0,5343.0,1951.0,755.0,344.0,418.0,5.7,5.0,6.7,3232.0,6.5,24846.0,6.6,12509.0,6.5,33401.0,6.7,3.0,6.6,2259.0,6.5,19868.0,6.6,10249.0,6.9,8041.0,2.0,1.0,6.8,933.0,6.9,4704.0,7.0,2085.0,6.5,496.0,6.7,10621.0,6.5,26219.0,Copycat - Omicidi in serie,1996-04-12,"Drama, Mystery, Thriller",123.0,USA,English,Jon Amiel,"Ann Biderman, David Madsen",Regency Enterprises,"Sigourney Weaver, Holly Hunter, Dermot Mulroney, William McNamara, Harry Connick Jr., J.E. Freeman, Will Patton, John Rothman, Shannon O'Hurley, Bob Greene, Tony Haney, Danny Kovacs, Tahmus Rounds, Scott DeVenney, David Michael Silverman",An agoraphobic psychologist and a female detective must work together to take down a serial killer who copies serial killers from the past.,6.6,52901.0,$ 20000000,$ 32051917,$ 32051917,54.0,168.0,66.0
307,307,m307,Crash,2004,8.0,174003.0,['crime' 'drama'],tt0375679,7.7,415171.0,7.8,8.0,71680.0,83242.0,117627.0,71864.0,30205.0,13813.0,7427.0,4766.0,3635.0,10912.0,6.9,57.0,7.7,56017.0,7.8,224887.0,7.7,51079.0,7.8,280478.0,7.0,42.0,7.7,44341.0,7.8,185126.0,7.7,41096.0,7.8,60255.0,6.6,11.0,7.8,11006.0,7.8,37569.0,7.8,9213.0,7.2,752.0,7.6,93718.0,7.8,203490.0,Crash: Contatto fisico,2005-11-11,"Crime, Drama, Thriller",112.0,"USA, Germany","English, Persian, Spanish, Mandarin, Korean",Paul Haggis,"Paul Haggis, Paul Haggis",Bob Yari Productions,"Karina Arroyave, Dato Bakhtadze, Sandra Bullock, Don Cheadle, Art Chudabala, Sean C. Cooper, Tony Danza, Keith David, Loretta Devine, Matt Dillon, Jennifer Esposito, Ime Etuk, Eddie J. Fernandez, William Fichtner, Howard Fong","Los Angeles citizens with vastly separate lives collide in interweaving stories of race, loss and redemption.",7.7,415171.0,$ 6500000,$ 54580300,$ 98410061,66.0,1691.0,295.0
308,308,m308,Crazy Love,2007,7.0,944.0,['documentary'],,,,,,,,,,,,,,,,,,,,,,,,,,,,,,,,,,,,,,,,,,,,,,,,,,,,,,,,,,,,,,,,,,,,
309,309,m309,Crime Spree,2003,6.4,3129.0,['action' 'comedy' 'crime'],tt0310924,6.5,5228.0,6.7,7.0,430.0,299.0,836.0,1458.0,1161.0,530.0,226.0,120.0,82.0,86.0,5.0,1.0,6.8,337.0,6.6,2422.0,6.4,1449.0,6.5,3803.0,5.0,1.0,6.8,284.0,6.5,2199.0,6.4,1266.0,6.9,406.0,,,7.0,48.0,6.9,202.0,6.9,151.0,6.0,121.0,6.6,695.0,6.5,3282.0,Crime Spree - Fuga da Chicago,2004-07-09,"Action, Comedy, Crime",105.0,"UK, Canada","English, French",Brad Mirman,Brad Mirman,GFT Entertainment,"Gérard Depardieu, Harvey Keitel, Johnny Hallyday, Renaud, Saïd Taghmaoui, Stéphane Freiss, Shawn Lawrence, Albert Dray, Joanne Kelly, Richard Bohringer, Abe Vigoda, Gino Marrocco, Sal Figliomeni, Diego Chambers, Carlos Diaz","A French gang of thieves flies over to Chicago for a one time job. However, things seem to get out of hand soon.",6.5,5228.0,$ 10000000,,$ 2451607,,49.0,17.0
310,310,m310,Crouching Tiger Hidden Dragon,2003,8.0,1091.0,['action'],,,,,,,,,,,,,,,,,,,,,,,,,,,,,,,,,,,,,,,,,,,,,,,,,,,,,,,,,,,,,,,,,,,,
311,311,m311,The Crow,1994,7.6,55886.0,['action' 'crime' 'fantasy' 'thriller'],tt0109506,7.6,163631.0,7.8,8.0,31117.0,23308.0,42897.0,35859.0,16612.0,6948.0,3049.0,1541.0,992.0,1308.0,7.9,23.0,7.6,20098.0,7.6,85276.0,7.5,21449.0,7.5,109189.0,7.8,18.0,7.5,15453.0,7.5,71508.0,7.4,18313.0,7.8,20970.0,8.0,3.0,7.9,4400.0,7.8,12861.0,7.7,2836.0,7.2,670.0,7.7,35774.0,7.5,76609.0,Il corvo - The Crow,1994-09-22,"Action, Drama, Fantasy",102.0,USA,English,Alex Proyas,"James O'Barr, David J. Schow",Crowvision Inc.,"Brandon Lee, Rochelle Davis, Ernie Hudson, Michael Wincott, Bai Ling, Sofia Shinas, Anna Thomson, David Patrick Kelly, Angel David, Laurence Mason, Michael Massee, Tony Todd, Jon Polito, Bill Raymond, Marco Rodríguez",A man brutally murdered comes back to life as an undead avenger of his and his fiancée's murder.,7.6,163631.0,$ 23000000,$ 50693129,$ 50693129,71.0,609.0,150.0
312,312,m312,Cruel Intentions,1999,6.7,67532.0,['drama' 'romance' 'thriller'],tt0139134,6.8,176314.0,7.0,7.0,20242.0,15635.0,32512.0,47567.0,31467.0,14594.0,6531.0,3330.0,2022.0,2414.0,6.3,22.0,6.9,25315.0,6.8,94759.0,6.5,16954.0,6.7,92884.0,5.0,4.0,6.7,11695.0,6.8,64955.0,6.5,13339.0,7.1,47325.0,6.8,10.0,7.1,13200.0,7.1,28816.0,6.7,3367.0,6.5,606.0,6.8,35802.0,6.8,85848.0,Cruel Intentions - Prima regola non innamorarsi,1999-08-27,"Drama, Romance",97.0,USA,"English, Vietnamese, French",Roger Kumble,"Choderlos de Laclos, Roger Kumble",Columbia Pictures,"Sarah Michelle Gellar, Ryan Phillippe, Reese Witherspoon, Selma Blair, Louise Fletcher, Joshua Jackson, Eric Mabius, Sean Patrick Thomas, Swoosie Kurtz, Christine Baranski, Alaina Reed-Hall, Deborah Offner, Tara Reid, Herta Ware, Hiep Thi Le",Two vicious step-siblings of an elite Manhattan prep school make a wager: to deflower the new headmaster's daughter before the start of term.,6.8,176314.0,$ 10500000,$ 38773785,$ 76347426,56.0,764.0,101.0
313,313,m313,The Curse Of The Cat People,1944,6.9,2067.0,['drama' 'fantasy' 'horror'],tt0036733,6.9,5591.0,7.0,7.0,521.0,538.0,1013.0,1539.0,1029.0,511.0,227.0,105.0,56.0,52.0,7.5,2.0,6.9,332.0,6.7,1899.0,6.9,2184.0,6.8,3807.0,7.0,1.0,6.9,260.0,6.6,1600.0,6.9,1865.0,7.4,646.0,,,7.3,66.0,7.5,273.0,7.3,291.0,6.6,277.0,7.0,2249.0,6.7,1978.0,Il giardino delle streghe,1951-06-06,"Drama, Horror, Mystery",70.0,USA,English,"Gunther von Fritsch, Robert Wise",DeWitt Bodeen,RKO Radio Pictures,"Simone Simon, Kent Smith, Jane Randolph, Ann Carter, Eve March, Julia Dean, Elizabeth Russell, Erford Gage, Sir Lancelot","The young, friendless daughter of Oliver and Alice Reed befriends her father's dead first wife and an aging, reclusive actress.",6.9,5591.0,$ 150000,,,,99.0,81.0
314,314,m314,The Curse,1987,4.5,627.0,['sci-fi' 'horror'],tt0092809,5.2,2682.0,5.3,5.0,145.0,63.0,156.0,305.0,506.0,587.0,420.0,223.0,126.0,151.0,3.0,2.0,5.2,139.0,5.2,1219.0,5.0,752.0,5.2,1937.0,2.0,1.0,5.3,115.0,5.2,1079.0,5.1,671.0,4.8,231.0,,,5.0,21.0,5.0,125.0,4.5,72.0,4.8,152.0,5.2,817.0,5.0,1123.0,La fattoria maledetta,1988-09-14,"Horror, Sci-Fi",92.0,"Italy, USA",English,David Keith,David Chaskin,Trans World Entertainment (TWE),"Wil Wheaton, Claude Akins, Malcolm Danare, Cooper Huckabee, John Schneider, Amy Wheaton, Steve Carlisle, Kathleen Jordon Gregory, Hope North, Steve Davis","When a meteorite lands near his family farm during a storm in Tennessee, the son of a struggling farmer believes it's connected to strange plague-like events afflicting the crops, the farm animals and even the family themeselves.",5.2,2682.0,,$ 1930001,$ 1930001,,73.0,49.0
315,315,m315,Dark City,1998,7.8,64262.0,['mystery' 'sci-fi' 'thriller'],tt0118929,7.6,185231.0,7.7,8.0,23846.0,32434.0,57783.0,40556.0,17172.0,6556.0,2876.0,1542.0,948.0,1518.0,7.3,23.0,7.5,20070.0,7.7,97696.0,7.6,27991.0,7.6,133840.0,7.3,18.0,7.5,17601.0,7.7,87439.0,7.6,24644.0,7.6,14800.0,9.0,4.0,7.4,2249.0,7.6,9173.0,7.7,2892.0,7.4,670.0,7.8,37341.0,7.6,93135.0,Dark City,1998-09-25,"Mystery, Sci-Fi, Thriller",100.0,Australia,English,Alex Proyas,"Alex Proyas, Alex Proyas",Mystery Clock Cinema,"Rufus Sewell, William Hurt, Kiefer Sutherland, Jennifer Connelly, Richard O'Brien, Ian Richardson, Bruce Spence, Colin Friels, John Bluthal, Mitchell Butel, Melissa George, Frank Gallacher, Ritchie Singer, Justin Monjo, Nicholas Bell","A man struggles with memories of his past, which includes a wife he cannot remember, and a nightmarish world, no one else seems to be waking up from.",7.6,185231.0,$ 27000000,$ 14378331,$ 27200316,66.0,686.0,216.0
316,316,m316,Dave,1993,6.8,20807.0,['comedy' 'romance'],tt0106673,6.8,48156.0,7.0,7.0,2972.0,3759.0,9821.0,15392.0,9694.0,3971.0,1412.0,551.0,262.0,322.0,6.0,1.0,6.9,2114.0,6.6,19357.0,7.0,14296.0,6.8,29541.0,6.0,1.0,6.9,1501.0,6.6,15433.0,6.9,11677.0,6.9,6981.0,,,7.1,583.0,6.7,3694.0,7.1,2440.0,6.5,478.0,7.0,15680.0,6.6,17446.0,Dave - Presidente per un giorno,1993-05-07,"Comedy, Romance",110.0,USA,"English, Spanish",Ivan Reitman,Gary Ross,Warner Bros.,"Kevin Kline, Sigourney Weaver, Frank Langella, Kevin Dunn, Ving Rhames, Ben Kingsley, Charles Grodin, Faith Prince, Laura Linney, Bonnie Hunt, Parley Baer, Stefan Gierasch, Anna Deavere Smith, Charles Hallahan, Tom Dugan","To avoid a potentially explosive scandal when the U.S. President goes into a coma, an affable temp agency owner with an uncanny resemblance is put in his place.",6.8,48156.0,$ 28000000,$ 63270710,$ 63270710,76.0,146.0,55.0
317,317,m317,Day Of The Dead,1985,7.0,22746.0,['horror' 'sci-fi'],tt0088993,7.2,61875.0,7.3,7.0,7730.0,6314.0,13635.0,17277.0,9126.0,3991.0,1591.0,915.0,494.0,802.0,7.1,9.0,7.3,6554.0,7.2,31576.0,6.9,10072.0,7.2,45215.0,6.9,6.0,7.3,5866.0,7.2,28825.0,7.0,9054.0,7.0,4030.0,7.0,2.0,7.0,599.0,7.0,2423.0,6.7,870.0,6.5,531.0,7.2,16810.0,7.1,26997.0,Il giorno degli zombi,1986-04-10,"Horror, Thriller",96.0,USA,English,George A. Romero,George A. Romero,United Film Distribution Company (UFDC),"Lori Cardille, Terry Alexander, Joseph Pilato, Jarlath Conroy, Anthony Dileo Jr., Richard Liberty, Sherman Howard, Gary Howard Klar, Ralph Marrero, John Amplas, Phillip G. Kellams, Taso N. Stavrakis, Greg Nicotero, Don Brockett, William Cameron",A small group of military officers and scientists dwell in an underground bunker as the world above is overrun by zombies.,7.2,61875.0,$ 3500000,$ 5000000,$ 5000000,60.0,454.0,131.0
318,318,m318,Dead Poets Society,1989,7.8,90842.0,['drama'],tt0097165,8.1,411182.0,8.1,8.0,74669.0,92311.0,134474.0,68742.0,22844.0,8653.0,3823.0,2078.0,1363.0,2225.0,8.3,267.0,8.2,85538.0,8.0,154500.0,8.0,50752.0,8.0,229507.0,8.4,158.0,8.2,58190.0,7.9,117421.0,7.9,40460.0,8.3,74667.0,8.2,78.0,8.4,25620.0,8.2,35000.0,8.2,9429.0,7.6,768.0,8.0,68111.0,8.0,177168.0,L'attimo fuggente,1989-09-29,"Comedy, Drama",128.0,USA,"English, Latin",Peter Weir,Tom Schulman,Touchstone Pictures,"Robin Williams, Robert Sean Leonard, Ethan Hawke, Josh Charles, Gale Hansen, Dylan Kussman, Allelon Ruggiero, James Waterston, Norman Lloyd, Kurtwood Smith, Carla Belver, Leon Pownall, George Martin, Joe Aufiery, Matt Carey",Maverick teacher John Keating uses poetry to embolden his boarding school students to new heights of self-expression.,8.1,411182.0,$ 16400000,$ 95860116,$ 235860116,79.0,634.0,106.0
