143,143,m143,Mystery Men,1999,5.9,31817.0,['action' 'comedy' 'fantasy'],tt0132347,6.1,61124.0,6.2,6.0,3913.0,3205.0,8087.0,13482.0,13687.0,8500.0,4458.0,2576.0,1511.0,1705.0,6.7,10.0,6.3,4530.0,6.0,30039.0,6.2,12272.0,6.1,41221.0,6.5,6.0,6.3,3856.0,6.0,25808.0,6.2,10432.0,6.1,6382.0,6.7,3.0,6.3,623.0,5.9,3918.0,6.3,1656.0,5.7,486.0,6.1,22236.0,6.0,21384.0,Mystery Men,2000-06-23,"Action, Comedy, Fantasy",121.0,USA,English,Kinka Usher,"Neil Cuthbert, Bob Burden",Universal Pictures,"Hank Azaria, Janeane Garofalo, William H. Macy, Kel Mitchell, Paul Reubens, Ben Stiller, Wes Studi, Greg Kinnear, Geoffrey Rush, Lena Olin, Eddie Izzard, Artie Lange, Pras Michel, Claire Forlani, Tom Waits",A group of inept amateur superheroes must try to save the day when a supervillain threatens to destroy a major superhero and the city.,6.1,61124.0,$ 68000000,$ 29762011,$ 33461011,65.0,453.0,138.0
144,144,m144,Napoleon,1995,5.5,486.0,['family' 'adventure'],tt0113932,6.1,1645.0,6.6,6.0,317.0,78.0,133.0,247.0,351.0,267.0,103.0,56.0,37.0,56.0,5.0,2.0,6.4,545.0,5.8,557.0,5.5,197.0,5.9,875.0,4.0,1.0,6.2,328.0,5.6,372.0,5.6,151.0,6.5,450.0,6.0,1.0,6.8,211.0,6.4,179.0,5.2,43.0,5.4,88.0,5.9,352.0,6.0,820.0,Napoleon,1995-07-13,"Adventure, Family",81.0,"Australia, Japan",English,Mario Andreacchio,"Mario Andreacchio, Michael Bourchier",AMPCO Films,"Jamie Croft, Philip Quast, Susan Lyons, Coralie Sawade, Brenton Whittle, Anne-Louise Lambert, Carole Skinner, Catherine Lambert, Tracey Canini, Annabel Sims, Neusa Timms, Debbie Horn, Lucia Mastrantone, Frank Whitten, Fiona Press","The adventures of Golden Retriever pup Napoleon and his friend, the parrot Birdo Lucci.",6.1,1645.0,AUD 4300000,,,,21.0,10.0
145,145,m145,Next Friday,2000,5.4,10267.0,['comedy'],tt0195945,6.2,36064.0,6.4,6.0,3307.0,1669.0,3780.0,7513.0,9304.0,5378.0,2470.0,1163.0,702.0,778.0,6.1,16.0,6.4,5098.0,6.0,18265.0,5.9,3093.0,6.1,24964.0,5.6,12.0,6.4,4538.0,6.0,16567.0,5.8,2554.0,6.2,2694.0,7.7,3.0,6.6,495.0,6.1,1523.0,6.1,501.0,5.1,305.0,6.1,10906.0,6.0,12267.0,Next Friday,2000-01-12,Comedy,98.0,USA,"English, Spanish",Steve Carr,"Ice Cube, DJ Pooh",New Line Cinema,"Ice Cube, Mike Epps, Justin Pierce, John Witherspoon, Don 'D.C.' Curry, Jacob Vargas, Lobo Sebastian, Rolando Molina, Lisa Rodríguez, Tommy 'Tiny' Lister, Kym Whitley, Amy Hill, Tamala Jones, The Lady of Rage, Carmen Serano",Uncle Elroy and Day Day owe money on taxes so Craig finds a way to steal from the next door neighbors to pay off the taxes so Uncle Elroy's house doesn't get put up for auction.,6.2,36064.0,$ 11000000,$ 57328603,$ 59827328,41.0,88.0,17.0
146,146,m146,Nick Of Time,1995,6.2,15945.0,['crime' 'drama' 'thriller'],tt0113972,6.3,38419.0,6.4,6.0,1743.0,1244.0,4309.0,11232.0,11162.0,5183.0,1912.0,798.0,422.0,414.0,8.3,3.0,6.5,3709.0,6.3,18808.0,6.2,7210.0,6.3,24329.0,6.0,1.0,6.4,2417.0,6.3,15246.0,6.2,5916.0,6.3,6027.0,9.5,2.0,6.5,1250.0,6.2,3360.0,6.3,1192.0,6.1,449.0,6.3,7821.0,6.3,19347.0,Minuti contati,1995-11-22,"Action, Crime, Drama",90.0,USA,English,John Badham,Patrick Sheane Duncan,Paramount Pictures,"Johnny Depp, Courtney Chase, Charles S. Dutton, Christopher Walken, Roma Maffia, Marsha Mason, Peter Strauss, Gloria Reuben, Bill Smitrovich, G.D. Spradlin, Yul Vazquez, Edith Diaz, Armando Ortega, C.J. Bau, Cynthena Sanders","An unimpressive, everyday man is forced into a situation where he is told to kill a politician to save his kidnapped daughter.",6.3,38419.0,$ 33000000,$ 8175346,$ 8175346,,142.0,38.0
147,147,m147,The Night Of The Hunter,1955,8.2,26211.0,['drama' 'film-noir' 'thriller'],tt0048424,8.0,80215.0,7.9,8.0,17245.0,16458.0,21039.0,12898.0,5814.0,2648.0,1287.0,796.0,584.0,1446.0,8.5,27.0,8.0,11231.0,7.9,33729.0,8.1,18095.0,8.0,55478.0,8.5,22.0,8.0,9546.0,7.9,29206.0,8.1,15062.0,8.0,8762.0,8.5,5.0,7.9,1548.0,8.0,4137.0,8.1,2782.0,7.9,637.0,8.2,20667.0,7.9,37291.0,La morte corre sul fiume,1956-02-11,"Crime, Drama, Film-Noir",92.0,USA,English,Charles Laughton,"Davis Grubb, James Agee",Paul Gregory Productions,"Robert Mitchum, Shelley Winters, Lillian Gish, James Gleason, Evelyn Varden, Peter Graves, Don Beddoe, Billy Chapin, Sally Jane Bruce, Gloria Castillo","A religious fanatic marries a gullible widow whose young children are reluctant to tell him where their real daddy hid the $10,000 he'd stolen in a robbery.",8.0,80215.0,$ 795000,,$ 2001,99.0,453.0,211.0
148,148,m148,A Nightmare On Elm Street,1984,7.4,47161.0,['horror'],tt0087800,7.5,200307.0,7.6,8.0,26869.0,23587.0,56824.0,54386.0,22506.0,8504.0,3385.0,1786.0,1004.0,1456.0,7.7,146.0,7.5,35531.0,7.5,88551.0,7.4,24975.0,7.5,127170.0,7.7,107.0,7.5,26898.0,7.5,73049.0,7.4,20900.0,7.4,27694.0,7.6,25.0,7.4,8007.0,7.4,14467.0,7.5,3725.0,7.4,744.0,7.7,45284.0,7.3,83534.0,Nightmare - Dal profondo della notte,1984-11-16,Horror,91.0,USA,English,Wes Craven,Wes Craven,New Line Cinema,"John Saxon, Ronee Blakley, Heather Langenkamp, Amanda Wyss, Jsu Garcia, Johnny Depp, Charles Fleischer, Joseph Whipp, Robert Englund, Lin Shaye, Joe Unger, Mimi Craven, Jack Shea, Ed Call, Sandy Lipton",The monstrous spirit of a slain child murderer seeks revenge by invading the dreams of teenagers whose parents were responsible for his untimely death.,7.5,200307.0,$ 1800000,$ 25504513,$ 25504513,76.0,791.0,216.0
149,149,m149,Ninotchka,1939,7.9,6951.0,['comedy' 'romance'],tt0031725,7.9,18470.0,7.9,8.0,3075.0,3660.0,5751.0,3496.0,1382.0,570.0,207.0,89.0,75.0,165.0,7.4,6.0,7.9,1868.0,7.8,6898.0,8.0,5651.0,7.9,11406.0,6.5,4.0,7.9,1295.0,7.8,5291.0,8.0,4534.0,8.0,3230.0,8.5,2.0,8.0,555.0,7.9,1523.0,8.1,1043.0,7.6,386.0,8.0,5071.0,7.8,8466.0,Ninotchka,1948-03-16,"Comedy, Romance",110.0,USA,"English, Russian",Ernst Lubitsch,"Charles Brackett, Billy Wilder",Metro-Goldwyn-Mayer (MGM),"Greta Garbo, Melvyn Douglas, Ina Claire, Bela Lugosi, Sig Ruman, Felix Bressart, Alexander Granach, Gregory Gaye, Rolfe Sedan, Edwin Maxwell, Richard Carle",A stern Russian woman sent to Paris on official business finds herself attracted to a man who represents everything she is supposed to detest.,7.9,18470.0,$ 1365000,,,,109.0,65.0
150,150,m150,Nixon,1995,7.1,13878.0,['biography' 'drama'],tt0113987,7.1,28317.0,7.1,7.0,2524.0,2873.0,6177.0,8803.0,4340.0,1764.0,619.0,352.0,273.0,592.0,7.0,4.0,7.3,1468.0,7.1,12110.0,7.0,7680.0,7.1,19846.0,7.0,2.0,7.3,1321.0,7.1,11167.0,7.0,6829.0,7.0,1754.0,7.0,2.0,7.2,134.0,6.9,825.0,7.0,750.0,6.7,415.0,7.1,7458.0,7.0,12452.0,Gli intrighi del potere - Nixon,1996-03-29,"Biography, Drama, History",192.0,USA,"English, Mandarin, Russian",Oliver Stone,"Stephen J. Rivele, Christopher Wilkinson",Cinergi Pictures Entertainment,"Anthony Hopkins, Joan Allen, Powers Boothe, Ed Harris, Bob Hoskins, E.G. Marshall, David Paymer, David Hyde Pierce, Paul Sorvino, Mary Steenburgen, J.T. Walsh, James Woods, Brian Bedford, Kevin Dunn, Fyvush Finkel",A biographical story of former U.S. President,7.1,28317.0,$ 44000000,$ 13681765,$ 13681765,66.0,171.0,79.0
151,151,m151,No Country For Old Men,2007,8.3,202649.0,['crime' 'drama' 'mystery' 'thriller' 'western'],tt0477348,8.1,831694.0,8.0,8.0,147688.0,212218.0,242175.0,127493.0,48176.0,20877.0,9968.0,6314.0,4818.0,11967.0,8.5,423.0,8.3,160250.0,8.1,365202.0,8.0,85506.0,8.2,562853.0,8.6,327.0,8.3,137679.0,8.1,318260.0,8.0,72820.0,7.7,78320.0,8.0,45.0,7.8,19747.0,7.7,42679.0,7.8,11296.0,7.9,824.0,8.4,147579.0,8.0,367175.0,Non è un paese per vecchi,2008-02-22,"Crime, Drama, Thriller",122.0,"USA, Mexico","English, Spanish","Ethan Coen, Joel Coen","Joel Coen, Ethan Coen",Paramount Vantage,"Tommy Lee Jones, Javier Bardem, Josh Brolin, Woody Harrelson, Kelly Macdonald, Garret Dillahunt, Tess Harper, Barry Corbin, Stephen Root, Rodger Boyce, Beth Grant, Ana Reeder, Kit Gwin, Zach Hopkins, Chip Love",Violence and mayhem ensue after a hunter stumbles upon a drug deal gone wrong and more than two million dollars in cash near the Rio Grande.,8.1,831694.0,$ 25000000,$ 74283625,$ 171627166,91.0,1850.0,524.0
152,152,m152,Nurse Betty,2000,6.4,20473.0,['comedy' 'crime' 'romance' 'thriller'],tt0171580,6.1,32633.0,6.3,7.0,1215.0,1750.0,5009.0,8423.0,7558.0,4246.0,1950.0,997.0,720.0,765.0,6.8,4.0,6.1,1307.0,6.1,13771.0,6.2,8930.0,6.1,19104.0,5.7,3.0,6.2,836.0,6.1,10596.0,6.2,7298.0,6.0,5139.0,10.0,1.0,5.9,448.0,5.9,3018.0,6.2,1518.0,6.0,402.0,6.2,8982.0,6.1,13934.0,Betty Love,2001-11-23,"Comedy, Crime, Drama",110.0,"Germany, USA","English, Spanish",Neil LaBute,"John C. Richards, John C. Richards",Gramercy Pictures (I),"Morgan Freeman, Renée Zellweger, Chris Rock, Greg Kinnear, Aaron Eckhart, Tia Texada, Crispin Glover, Pruitt Taylor Vince, Allison Janney, Kathleen Wilhoite, Elizabeth Mitchell, Susan Barnes, Harriet Sansom Harris, Sung Hi Lee, Laird Macintosh",Comedy about a widow's post-traumatic obsession with a soap star.,6.1,32633.0,$ 35000000,$ 25170054,$ 29364989,69.0,262.0,162.0
153,153,m153,O Brother Where Art Thou,2000,7.8,95628.0,['comedy' 'adventure' 'crime' 'music'],tt0190590,7.7,279523.0,7.8,8.0,37836.0,51576.0,90865.0,59026.0,22650.0,8282.0,3706.0,2048.0,1329.0,2205.0,7.8,75.0,7.7,42413.0,7.7,126331.0,7.8,42590.0,7.7,185586.0,7.9,60.0,7.7,35156.0,7.7,107576.0,7.8,35463.0,7.7,31709.0,6.7,9.0,7.7,6621.0,7.7,17290.0,7.8,6460.0,7.3,732.0,8.0,65446.0,7.6,122544.0,"Fratello, dove sei?",2000-11-10,"Adventure, Comedy, Crime",107.0,"UK, France, USA",English,"Joel Coen, Ethan Coen","Homer, Ethan Coen",Touchstone Pictures,"George Clooney, John Turturro, Tim Blake Nelson, John Goodman, Holly Hunter, Chris Thomas King, Charles Durning, Del Pentecost, Michael Badalucco, J.R. Horne, Brian Reddy, Wayne Duvall, Ed Gale, Ray McKinnon, Daniel von Bargen","In the deep south during the 1930s, three escaped convicts search for hidden treasure while a relentless lawman pursues them.",7.7,279523.0,$ 26000000,$ 45512588,$ 71868327,69.0,910.0,100.0
154,154,m154,An Officer And A Gentleman,1982,6.8,16883.0,['drama' 'romance'],tt0084434,7.0,48093.0,7.1,7.0,3878.0,4205.0,10643.0,15636.0,8133.0,3143.0,1205.0,558.0,312.0,380.0,6.8,7.0,7.2,3524.0,6.8,17121.0,7.2,15798.0,7.0,28332.0,8.5,2.0,7.2,2153.0,6.8,12637.0,7.1,12503.0,7.1,9109.0,6.6,5.0,7.1,1318.0,6.9,4306.0,7.4,3070.0,6.7,503.0,7.2,12421.0,6.9,20607.0,Ufficiale e gentiluomo,1983-01-14,"Drama, Romance",124.0,USA,"English, Filipino",Taylor Hackford,Douglas Day Stewart,Lorimar Film Entertainment,"Richard Gere, Debra Winger, David Keith, Robert Loggia, Lisa Blount, Lisa Eilbacher, Louis Gossett Jr., Tony Plana, Harold Sylvester, David Caruso, Victor French, Grace Zabriskie, Tommy Petersen, Mara Scott-Wood, David Greenfield","A young man must complete his work at a Navy Officer Candidate School to become an aviator, with the help of a tough Gunnery Sergeant and his new girlfriend.",7.0,48093.0,$ 7500000,$ 129795554,$ 129795554,75.0,144.0,50.0
155,155,m155,Panic Room,2002,6.9,69824.0,['thriller'],tt0258000,6.8,253016.0,6.9,7.0,11029.0,13531.0,46556.0,91927.0,58099.0,19563.0,6536.0,2758.0,1365.0,1652.0,7.2,86.0,6.9,41891.0,6.7,121866.0,6.7,30066.0,6.8,160747.0,7.1,59.0,7.0,30128.0,6.7,98857.0,6.7,25023.0,6.8,39216.0,7.3,19.0,6.9,11165.0,6.7,21554.0,6.8,4555.0,6.9,740.0,6.8,42479.0,6.7,126534.0,Panic Room,2002-04-19,"Crime, Drama, Thriller",112.0,USA,English,David Fincher,David Koepp,Columbia Pictures,"Jodie Foster, Kristen Stewart, Forest Whitaker, Dwight Yoakam, Jared Leto, Patrick Bauchau, Ann Magnuson, Ian Buchanan, Andrew Kevin Walker, Paul Schulze, Mel Rodriguez, Richard Conant, Paul Simon, Victor Thrash, Ken Turner","A divorced woman and her diabetic daughter take refuge in their newly-purchased house's safe room, when three men break-in, searching for a missing fortune.",6.8,253016.0,$ 48000000,$ 96397334,$ 197079546,65.0,910.0,242.0
156,156,m156,Panther,1995,5.9,1129.0,['drama'],tt0114084,6.5,2261.0,6.7,7.0,369.0,144.0,298.0,408.0,448.0,284.0,126.0,43.0,24.0,117.0,5.5,2.0,7.0,98.0,6.6,1075.0,6.0,561.0,6.4,1511.0,6.0,1.0,6.9,79.0,6.5,916.0,5.9,470.0,7.5,256.0,5.0,1.0,7.8,18.0,7.5,147.0,7.3,83.0,5.6,127.0,6.5,767.0,6.4,841.0,Panther,1995-05-03,Drama,124.0,"UK, USA",English,Mario Van Peebles,"Melvin Van Peebles, Melvin Van Peebles",Gramercy Pictures (I),"Kadeem Hardison, Bokeem Woodbine, Joe Don Baker, Courtney B. Vance, Tyrin Turner, Marcus Chong, Anthony Griffith, Bobby Brown, Angela Bassett, Nefertiti, James Russo, Jenifer Lewis, Chris Rock, Roger Guenveur Smith, Michael Wincott",A dramatized account of the story of The Black Panther Party of Self-Defense.,6.5,2261.0,,$ 6834525,$ 6834525,,23.0,13.0
157,157,m157,The Patriot,2000,6.9,79207.0,['action' 'drama' 'war'],tt0187393,7.2,250764.0,7.3,7.0,26665.0,29134.0,61477.0,69219.0,33415.0,14235.0,6379.0,3686.0,2366.0,4188.0,7.7,54.0,7.5,34327.0,7.1,121972.0,7.0,33609.0,7.2,170665.0,7.9,41.0,7.5,28718.0,7.1,105559.0,7.0,28500.0,7.2,26090.0,6.9,8.0,7.5,5154.0,7.1,15079.0,7.3,4647.0,6.8,706.0,7.4,58929.0,7.0,106075.0,Il patriota,2000-08-25,"Action, Drama, History",165.0,"USA, Germany","English, French",Roland Emmerich,Robert Rodat,Columbia Pictures,"Mel Gibson, Heath Ledger, Joely Richardson, Jason Isaacs, Chris Cooper, Tchéky Karyo, Rene Auberjonois, Lisa Brenner, Tom Wilkinson, Donal Logue, Leon Rippy, Adam Baldwin, Jay Arlen Jones, Joey D. Vieira, Gregory Smith",Peaceful farmer Benjamin Martin is driven to lead the Colonial Militia during the American Revolution when a sadistic British officer murders his son.,7.2,250764.0,$ 110000000,$ 113330342,$ 215294342,63.0,1196.0,206.0
158,158,m158,Pet Sematary,1989,6.3,19851.0,['drama' 'fantasy' 'horror' 'mystery' 'thriller'],tt0098084,6.6,92050.0,6.7,7.0,6610.0,5434.0,14298.0,25885.0,21026.0,9899.0,4532.0,2051.0,1149.0,1166.0,6.1,48.0,6.5,11859.0,6.6,43635.0,6.5,14628.0,6.5,57763.0,6.0,31.0,6.5,8351.0,6.6,34787.0,6.4,11996.0,6.7,14766.0,6.9,7.0,6.6,3264.0,6.8,8305.0,6.7,2406.0,6.1,587.0,6.6,22027.0,6.5,39117.0,Cimitero vivente,1989-06-23,"Fantasy, Horror, Thriller",103.0,USA,English,Mary Lambert,"Stephen King, Stephen King",Paramount Pictures,"Dale Midkiff, Fred Gwynne, Denise Crosby, Brad Greenquist, Michael Lombard, Miko Hughes, Blaze Berdahl, Susan Blommaert, Mara Clark, Kavi Raz, Mary Louise Wilson, Andrew Hubatsek, Liz Davies, Kara Dalke, Matthew August Ferrell","After tragedy strikes, a grieving father discovers an ancient burial ground behind his home with the power to raise the dead.",6.6,92050.0,$ 11500000,$ 57469467,$ 57469467,38.0,351.0,118.0
159,159,m159,Pirates Of The Caribbean,2003,7.2,329.0,['adventure' 'fantasy' 'horror'],,,,,,,,,,,,,,,,,,,,,,,,,,,,,,,,,,,,,,,,,,,,,,,,,,,,,,,,,,,,,,,,,,,,
160,160,m160,Plastic Man,1999,6.7,29.0,['drama'],,,,,,,,,,,,,,,,,,,,,,,,,,,,,,,,,,,,,,,,,,,,,,,,,,,,,,,,,,,,,,,,,,,,
161,161,m161,Platinum Blonde,1931,6.9,1119.0,['comedy' 'romance'],tt0022268,6.9,2719.0,6.9,7.0,184.0,164.0,502.0,946.0,544.0,229.0,86.0,27.0,16.0,21.0,7.0,1.0,6.9,118.0,6.8,788.0,6.9,1198.0,6.8,1682.0,7.0,1.0,6.8,77.0,6.7,591.0,6.9,977.0,7.1,451.0,,,7.1,40.0,7.1,186.0,7.0,207.0,6.5,197.0,6.9,1012.0,6.8,1017.0,La donna di platino,1933-11-01,"Comedy, Romance",89.0,USA,English,Frank Capra,"Harry Chandlee, Douglas W. Churchill",Columbia Pictures,"Loretta Young, Robert Williams, Jean Harlow, Halliwell Hobbes, Reginald Owen, Edmund Breese, Don Dillaway, Walter Catlett, Claud Allister, Louise Closser Hale","A young woman from a very rich family impulsively marries a reporter, but each assumes the other is the one whose lifestyle must change.",6.9,2719.0,GBP 600000,,,,60.0,27.0
162,162,m162,Pleasantville,1998,7.5,49669.0,['comedy' 'drama' 'fantasy'],tt0120789,7.5,119604.0,7.6,8.0,13315.0,17182.0,36377.0,31417.0,12761.0,4448.0,1765.0,843.0,544.0,952.0,7.5,20.0,7.7,13517.0,7.5,57061.0,7.4,21170.0,7.5,69561.0,7.7,16.0,7.7,8488.0,7.4,41896.0,7.4,17095.0,7.6,24078.0,6.7,3.0,7.8,4861.0,7.6,14561.0,7.6,3752.0,7.1,633.0,7.5,35846.0,7.5,48010.0,Pleasantville,1999-04-16,"Comedy, Drama, Fantasy",124.0,USA,English,Gary Ross,Gary Ross,New Line Cinema,"William H. Macy, Joan Allen, Natalie Ramsey, Kevin Connors, Jeff Daniels, Tobey Maguire, Heather McGill, Paul Morgan Stetler, Denise Dowse, McNally Sagal, Jane Kaczmarek, Giuseppe Andrews, Reese Witherspoon, Marissa Ribisi, Jenny Lewis","Two 1990s teenage siblings find themselves in a 1950s sitcom, where their influence begins to profoundly change that complacent world.",7.5,119604.0,$ 60000000,$ 40584421,$ 49805462,71.0,727.0,157.0
163,163,m163,Punchdrunk Love,2002,7.4,50312.0,['comedy' 'drama' 'romance'],tt0272338,7.3,144254.0,7.3,8.0,17381.0,20120.0,36674.0,33729.0,16855.0,8025.0,3958.0,2444.0,1827.0,3241.0,8.2,74.0,7.5,23399.0,7.2,67942.0,6.9,17362.0,7.3,96183.0,8.3,59.0,7.6,19627.0,7.3,58222.0,6.9,14644.0,6.6,15336.0,7.3,14.0,6.7,3411.0,6.6,8890.0,6.6,2404.0,6.7,587.0,7.5,36922.0,7.1,61045.0,Ubriaco d'amore,2003-03-21,"Comedy, Drama, Romance",95.0,USA,English,Paul Thomas Anderson,Paul Thomas Anderson,New Line Cinema,"Adam Sandler, Jason Andrews, Don McManus, Emily Watson, Luis Guzmán, David Schrempf, Seann Conway, Rico Bueno, Hazel Mailloux, Karen Kilgariff, Julie Hermelin, Salvador Curiel, Jorge Barahona, Ernesto Quintero, Julius Steuer","A psychologically troubled novelty supplier is nudged towards a romance with an English woman, all the while being extorted by a phone-sex line run by a crooked mattress salesman, and purchasing stunning amounts of pudding.",7.3,144254.0,$ 25000000,$ 17844216,$ 24665649,78.0,952.0,268.0
164,164,m164,Quills,2000,7.3,22657.0,['biography' 'drama' 'history' 'romance'],tt0180073,7.3,50924.0,7.4,8.0,5480.0,6587.0,14204.0,13620.0,6220.0,2323.0,1040.0,544.0,388.0,518.0,7.3,3.0,7.5,4214.0,7.3,25855.0,7.0,9808.0,7.2,27517.0,7.0,2.0,7.4,2301.0,7.3,17010.0,7.0,7501.0,7.5,12958.0,,,7.6,1854.0,7.5,8569.0,7.3,2174.0,6.6,430.0,7.2,11265.0,7.3,24932.0,Quills - La penna dello scandalo,2001-03-02,"Biography, Drama",124.0,"UK, Germany, USA","English, Latin",Philip Kaufman,"Doug Wright, Doug Wright",Fox Searchlight Pictures,"Geoffrey Rush, Kate Winslet, Joaquin Phoenix, Michael Caine, Billie Whitelaw, Patrick Malahide, Amelia Warner, Jane Menelaus, Stephen Moyer, Tony Pritchard, Michael Jenn, Danny Babington, George Antoni, Stephen Marcus, Elizabeth Berrington","In a Napoleonic era insane asylum, an inmate, the irrepressible Marquis De Sade, fights a battle of wills against a tyrannically prudish doctor.",7.3,50924.0,$ 13500000,$ 7065332,$ 17989227,70.0,312.0,99.0
165,165,m165,Rko 281,1999,7.1,3543.0,['biography' 'drama'],,,,,,,,,,,,,,,,,,,,,,,,,,,,,,,,,,,,,,,,,,,,,,,,,,,,,,,,,,,,,,,,,,,,
166,166,m166,Raging Bull,1980,8.4,91851.0,['biography' 'drama' 'sport'],tt0081398,8.2,313784.0,8.1,8.0,62681.0,73708.0,92696.0,49885.0,17632.0,7109.0,3525.0,1916.0,1374.0,3258.0,8.4,167.0,8.2,52059.0,8.1,135195.0,8.1,41977.0,8.2,218355.0,8.5,133.0,8.3,46945.0,8.2,124070.0,8.2,37085.0,7.7,19277.0,8.0,20.0,7.8,4418.0,7.7,9759.0,7.7,4274.0,7.9,742.0,8.3,63717.0,8.1,137609.0,Toro scatenato,1981-02-12,"Biography, Drama, Sport",129.0,USA,English,Martin Scorsese,"Jake LaMotta, Joseph Carter",Chartoff-Winkler Productions,"Robert De Niro, Cathy Moriarty, Joe Pesci, Frank Vincent, Nicholas Colasanto, Theresa Saldana, Mario Gallo, Frank Adonis, Joseph Bono, Frank Topham, Lori Anne Flax, Charles Scorsese, Don Dunphy, Bill Hanrahan, Rita Bennett",The life of boxer,8.2,313784.0,$ 18000000,$ 23383987,$ 23402427,89.0,593.0,191.0
167,167,m167,Rear Window,1954,8.7,121165.0,['crime' 'mystery' 'romance' 'thriller'],tt0047396,8.4,432390.0,8.4,9.0,100445.0,121475.0,119922.0,55957.0,17577.0,6786.0,3140.0,1719.0,1350.0,4019.0,8.7,234.0,8.5,75671.0,8.4,169413.0,8.5,66074.0,8.4,263108.0,8.8,171.0,8.5,58475.0,8.4,138516.0,8.5,53340.0,8.5,59781.0,8.0,44.0,8.4,16020.0,8.4,28898.0,8.7,11687.0,8.6,791.0,8.7,89399.0,8.4,181886.0,La finestra sul cortile,1955-04-14,"Mystery, Thriller",112.0,USA,English,Alfred Hitchcock,"John Michael Hayes, Cornell Woolrich",Alfred J. Hitchcock Productions,"James Stewart, Grace Kelly, Wendell Corey, Thelma Ritter, Raymond Burr, Judith Evelyn, Ross Bagdasarian, Georgine Darcy, Sara Berner, Frank Cady, Jesslyn Fax, Rand Harper, Irene Winston, Havis Davenport",A wheelchair-bound photographer spies on his neighbors from his apartment window and becomes convinced one of them has committed murder.,8.4,432390.0,$ 1000000,$ 36764313,$ 37032034,100.0,855.0,157.0
168,168,m168,Rebel Without A Cause,1955,7.9,27791.0,['drama' 'romance'],tt0048545,7.7,81625.0,7.8,8.0,12158.0,12635.0,25217.0,18415.0,7598.0,2891.0,1147.0,577.0,390.0,597.0,7.5,40.0,7.8,14372.0,7.6,32306.0,7.7,14732.0,7.7,48963.0,7.9,24.0,7.8,9793.0,7.6,25373.0,7.6,12090.0,7.7,13946.0,6.7,13.0,7.7,4350.0,7.7,6570.0,7.8,2456.0,7.5,600.0,7.9,20855.0,7.6,35241.0,Gioventù bruciata,1956-02-24,Drama,111.0,USA,English,Nicholas Ray,"Stewart Stern, Irving Shulman",Warner Bros.,"James Dean, Natalie Wood, Sal Mineo, Jim Backus, Ann Doran, Corey Allen, William Hopper, Rochelle Hudson, Dennis Hopper, Edward Platt, Steffi Sidney, Marietta Canty, Virginia Brissac, Beverly Long, Ian Wolfe","A rebellious young man with a troubled past comes to a new town, finding friends and enemies.",7.7,81625.0,$ 1500000,$ 199963,$ 199963,89.0,335.0,165.0
169,169,m169,Reindeer Games,2000,5.5,16951.0,['action' 'crime' 'drama' 'thriller'],tt0184858,5.8,37005.0,5.8,6.0,1219.0,912.0,2876.0,7193.0,10299.0,7091.0,3521.0,1868.0,1017.0,1009.0,6.2,4.0,6.0,2078.0,5.7,17929.0,5.9,8008.0,5.8,25368.0,6.0,3.0,6.0,1742.0,5.8,15860.0,5.9,6959.0,5.7,3279.0,7.0,1.0,6.0,311.0,5.5,1897.0,5.9,949.0,5.6,464.0,5.6,10083.0,5.9,15974.0,Trappola criminale,2000-12-01,"Action, Adventure, Crime",104.0,USA,English,John Frankenheimer,Ehren Kruger,Dimension Films,"Ben Affleck, James Frain, Dana Stubblefield, Mark Acheson, Tom Heaton, Isaac Hayes, Michael Sunczyk, Douglas Arthurs, Dean Wray, Ron Sauvé, Ron Jeremy, Hrothgar Mathews, Charlize Theron, Clarence Williams III, Donal Logue","After assuming his dead cell-mate's identity to get with the other man's girlfriend, an ex-convict finds himself a reluctant participant in a casino heist.",5.8,37005.0,$ 42000000,$ 23368995,$ 32168970,37.0,222.0,70.0
170,170,m170,Reservoir Dogs,1992,8.4,217185.0,['crime' 'mystery' 'thriller'],tt0105236,8.3,896551.0,8.2,8.0,161081.0,257036.0,277573.0,126097.0,38608.0,14593.0,7012.0,4245.0,3215.0,7091.0,8.5,563.0,8.4,177203.0,8.3,367361.0,8.2,89022.0,8.3,583870.0,8.5,433.0,8.4,149426.0,8.3,320271.0,8.2,76918.0,8.2,82578.0,8.1,70.0,8.2,24430.0,8.1,42476.0,8.0,10618.0,8.1,842.0,8.3,146907.0,8.3,383215.0,Le iene,1992-10-09,"Crime, Drama, Thriller",99.0,USA,English,Quentin Tarantino,"Quentin Tarantino, Quentin Tarantino",Live Entertainment,"Harvey Keitel, Tim Roth, Michael Madsen, Chris Penn, Steve Buscemi, Lawrence Tierney, Randy Brooks, Kirk Baltz, Edward Bunker, Quentin Tarantino, Rich Turner, David Steen, Tony Cosmo, Stevo Polyi, Michael Sottile","When a simple jewelry heist goes horribly wrong, the surviving criminals begin to suspect that one of them is a police informant.",8.3,896551.0,$ 1200000,$ 2832029,$ 2889963,79.0,1163.0,205.0
171,171,m171,Roughshod,1949,6.9,115.0,['action' 'drama' 'romance' 'western'],tt0041827,6.6,444.0,6.7,7.0,20.0,17.0,78.0,155.0,101.0,46.0,11.0,5.0,3.0,8.0,6.0,2.0,7.0,8.0,6.7,72.0,6.6,270.0,6.7,313.0,6.0,1.0,7.3,5.0,6.6,57.0,6.7,244.0,6.5,44.0,6.0,1.0,7.7,3.0,7.0,15.0,6.3,25.0,6.5,83.0,6.6,209.0,6.6,127.0,Donne di frontiera,1949-05-11,"Action, Adventure, Drama",88.0,USA,English,Mark Robson,"Peter Viertel, Daniel Mainwaring",RKO Radio Pictures,"Robert Sterling, Gloria Grahame, Claude Jarman Jr., John Ireland, Jeff Donnell, Myrna Dell, Martha Hyer, George Cooper, Jeff Corey, Sara Haden, James Bell, Sean McClory, Robert B. Williams, Steve Savage, Ed Cassidy",Wrangler Clay Phillips and his younger brother Steve are taking horses to their ranch near Sonora when they come across four dance hall girls heading the same way with a wrecked buggy. One ...,6.6,444.0,,,,,13.0,7.0
172,172,m172,Scary Movie 2,2001,4.7,44511.0,['comedy'],tt0257106,5.3,147183.0,5.5,5.0,8880.0,4326.0,9986.0,19893.0,29774.0,30683.0,18239.0,10855.0,7253.0,7294.0,4.9,74.0,5.5,35769.0,5.2,68292.0,5.0,9442.0,5.3,100204.0,4.6,56.0,5.6,28769.0,5.2,59059.0,5.0,8306.0,5.2,16844.0,6.1,9.0,5.4,6536.0,5.1,8601.0,5.1,997.0,4.7,634.0,5.3,24378.0,5.2,74630.0,Scary Movie 2,2001-10-12,"Comedy, Horror",83.0,"USA, Canada",English,Keenen Ivory Wayans,"Shawn Wayans, Marlon Wayans",Dimension Films,"Antony Acker, Mark Barrett, Richard Bellos, Suzanne Bianqui, Natale Bosco, Joann Connor, Bradley Fisher, Suzanne O'Donnell, Kristi Pearce, Donna Silverberg, Helene Strayer, Veronica Cartwright, Andy Richter, Lee R. Mayes, Natasha Lyonne",Four teens are tricked by Professor Oldman (Tim Curry) into visiting a haunted house for a school project.,5.3,147183.0,$ 45000000,$ 71308997,$ 141220678,29.0,560.0,135.0
173,173,m173,Serial Mom,1994,6.4,11077.0,['comedy' 'thriller'],tt0111127,6.8,26389.0,6.9,7.0,2929.0,2037.0,4553.0,6689.0,5108.0,2472.0,1116.0,605.0,343.0,537.0,7.6,6.0,7.1,1898.0,6.7,12010.0,6.7,6120.0,6.7,16072.0,7.8,4.0,7.0,1298.0,6.7,9228.0,6.6,5050.0,6.9,4382.0,8.5,2.0,7.2,568.0,6.9,2628.0,6.7,992.0,6.3,423.0,6.9,7686.0,6.6,10831.0,La signora ammazzatutti,1994-11-25,"Comedy, Crime, Thriller",95.0,USA,English,John Waters,John Waters,Savoy Pictures,"Kathleen Turner, Sam Waterston, Ricki Lake, Matthew Lillard, Scott Morgan, Walt MacPherson, Justin Whalin, Patricia Dunnock, Lonnie Horsey, Mink Stole, Mary Jo Catlett, John Badila, Kathy Fannon, Doug Roberts, Traci Lords",A sweet mother finds herself participating in homicidal activities when she sees the occasion call for it.,6.8,26389.0,$ 13000000,$ 7820688,$ 7820688,64.0,122.0,67.0
